{
  "$schema": "https://schemas.clark.pro/v1/ground-evidence-ledger.schema.json",
  "schemaVersion": "1.0.0",
  "ledgerId": "clark.evidence.ground",
  "stratum": "ground",
  "reviewedAt": "2026-07-12T22:40:52-05:00",
  "currentGate": "before-stratum-1-implementation",
  "gateState": "open",
  "entries": [
    {
      "id": "OBJ-01",
      "area": "objective",
      "requirement": "Clark begins as a Mac-first application with a permanent desktop process and security topology.",
      "ownerRole": "Desktop + Design Leads",
      "proofRequired": ["design_document", "adr"],
      "result": "defined",
      "evidence": [
        {"kind": "design_document", "location": "architecture.md", "claim": "Defines Studio, main, renderer, Harness, media workers, Keychain, Share capture, and direct Mac distribution topology.", "result": "pass"},
        {"kind": "adr", "location": "decisions/0001-mac-desktop-and-process-topology.md", "claim": "Accepts the Mac-first Electron topology and privileged process boundaries.", "result": "pass"},
        {"kind": "adr", "location": "decisions/0011-mac-entitlements-and-share-extension.md", "claim": "Accepts Developer ID, notarization, Hardened Runtime, and the Share-extension boundary.", "result": "pass"}
      ],
      "acceptanceRule": "Ground requires an accepted permanent Mac topology. Signed runtime, entitlements, notarization, native QA, and release evidence belong to Stratum 1.",
      "limitations": ["A bounded native runtime now exists, but no Developer ID-signed, hardened, notarized, or Gatekeeper-accepted release runtime exists."],
      "nextAction": "Extend the bounded desktop shell through the accepted Harness and persistence topology, then produce the signed Stratum 1 release evidence without creating an alternate browser path.",
      "groundBlocking": false,
      "releaseTarget": "stratum-1",
      "updatedAt": "2026-07-12T22:40:52-05:00"
    },
    {
      "id": "OBJ-02",
      "area": "objective",
      "requirement": "Clark has a provider-neutral durable Harness with explicit loops, checkpoints, budgets, recovery, and bounded agent work.",
      "ownerRole": "Harness Lead",
      "proofRequired": ["design_document", "adr", "schema", "fixture", "automated_test"],
      "result": "contract_verified",
      "evidence": [
        {"kind": "design_document", "location": "architecture.md", "claim": "Defines durable run, step, recovery, agent, and provider-neutral execution behavior.", "result": "pass"},
        {"kind": "adr", "location": "decisions/0003-provider-neutral-durable-harness.md", "claim": "Accepts a durable Harness above replaceable providers.", "result": "pass"},
        {"kind": "schema", "location": "contracts/schemas/loop-definition.schema.json", "claim": "Versions loop graphs, gates, permissions, budgets, and policies.", "result": "pass"},
        {"kind": "fixture", "location": "contracts/fixtures/full-week/run-plan.json", "claim": "Compiles the Full-Week loop into an eleven-step plan with approval, egress, budget, idempotency, and reconciliation data.", "result": "pass"},
        {"kind": "automated_test", "location": "contracts/verify.mjs", "claim": "Validates both loops, every compiled step, DAG integrity, permissions, budget, gates, and publishing safety.", "result": "pass", "command": "npm --prefix contracts run verify"}
      ],
      "acceptanceRule": "Ground requires one coherent and executable contract model; production restart, chaos, cost, and provider conformance proof belongs to later strata.",
      "limitations": ["No production run engine or forced-recovery test exists."],
      "nextAction": "Generate runtime types and implement the event-backed run state machine in Stratum 2.",
      "groundBlocking": false,
      "releaseTarget": "stratum-2",
      "updatedAt": "2026-07-12T20:20:00-05:00"
    },
    {
      "id": "OBJ-03",
      "area": "objective",
      "requirement": "The Focus and Canvas interaction model is proven strong enough before implementation fans out.",
      "ownerRole": "Product + Design + Research Leads",
      "proofRequired": ["prototype", "automated_test", "observed_session"],
      "result": "human_evidence_pending",
      "evidence": [
        {"kind": "prototype", "location": "prototype/index.html", "claim": "Implements Focus, the 50-object Canvas, lineage, impact, comparison, memory, Connections, keyboard control, and reversible staged state.", "result": "pass"},
        {"kind": "automated_test", "location": "prototype/verification.md", "claim": "Records controlled-browser interaction, runtime, and 320/390 responsive checks.", "result": "pass"},
        {"kind": "expert_review", "location": "prototype/cognitive-walkthroughs.md", "claim": "Records five expert workflow rehearsals while explicitly excluding them from participant evidence.", "result": "pass"}
      ],
      "acceptanceRule": "Five representative creators must pass the precommitted Canvas rubric; expert review and automated checks cannot substitute for observed behavior.",
      "limitations": ["Zero representative creator sessions have been recorded."],
      "nextAction": "Run five observed walkthroughs, synthesize the matrix, redesign every failed critical gate, and retest before Ground signoff.",
      "groundBlocking": true,
      "releaseTarget": "ground",
      "updatedAt": "2026-07-12T20:20:00-05:00"
    },
    {
      "id": "OBJ-04",
      "area": "objective",
      "requirement": "Clark consumes MCP servers and reusable external tools through capability and Tool Pack contracts that remain safe across transports and providers.",
      "ownerRole": "Connect + Security Leads",
      "proofRequired": ["design_document", "adr", "schema", "fixture", "automated_test"],
      "result": "contract_verified",
      "evidence": [
        {"kind": "design_document", "location": "mcp-ecosystem.md", "claim": "Defines Clark as an MCP host/client with negotiation, trust, lifecycle, and capability adaptation.", "result": "pass"},
        {"kind": "adr", "location": "decisions/0004-capabilities-above-mcp.md", "claim": "Places the Clark capability contract above MCP transport semantics.", "result": "pass"},
        {"kind": "adr", "location": "decisions/0022-governed-tool-packs-and-reuse-first-integration.md", "claim": "Accepts reuse-first integration while keeping external engines replaceable and Clark's canonical creator model authoritative.", "result": "pass"},
        {"kind": "schema", "location": "contracts/schemas/capability-manifest.schema.json", "claim": "Versions capability inputs, outputs, permissions, cost, approval, async, trust, and lifecycle.", "result": "pass"},
        {"kind": "schema", "location": "contracts/schemas/tool-package.schema.json", "claim": "Versions immutable source, license/dependency disposition, supply chain, installation, adapters, capabilities, converters, UI isolation, compatibility, tests, activation, updates, and rollback.", "result": "pass"},
        {"kind": "fixture", "location": "contracts/fixtures/full-week/capabilities/research.search.mcp.json", "claim": "Represents a read-only research MCP capability.", "result": "pass"},
        {"kind": "fixture", "location": "contracts/fixtures/tool-packages/opencut.rewrite.blocked.json", "claim": "Pins OpenCut source/tree/archive/license evidence while exposing zero installed authority until a stable upstream interface and complete activation evidence exist.", "result": "pass"},
        {"kind": "automated_test", "location": "contracts/verify.mjs", "claim": "Auto-discovers Tool Packs, validates integration-ladder/source/component/readiness semantics, proves a synthetic valid-active shape, and rejects active-without-adapter plus eleven hostile activation mutations.", "result": "pass", "command": "npm --prefix contracts run verify"},
        {"kind": "automated_test", "location": "mcp-conformance/verify.mjs", "claim": "Passes all thirty-two executable hostile/runtime cases plus four shared Bridge contract cases against the pinned protocol and SDK baseline.", "result": "pass", "command": "npm --prefix mcp-conformance run verify"}
      ],
      "acceptanceRule": "Ground requires versioned capability and Tool Pack semantics plus representative valid/invalid fixtures; hostile live-server and production installer evidence remain dependent-stratum work.",
      "limitations": ["The Ground runner is not the production Connect or Tool Pack installer runtime.", "OpenCut has no stable upstream interface at the pinned revision and is not an installed integration.", "Real-provider compatibility, package acquisition/rollback, remote network-fault, production credential-broker, and production Tasks evidence remains unbuilt."],
      "nextAction": "Carry the full thirty-six-case MCP matrix and Tool Pack acquisition/activation/upgrade/rollback gates into production, then activate only external tools with stable supported interfaces and complete evidence.",
      "groundBlocking": false,
      "releaseTarget": "stratum-3",
      "updatedAt": "2026-07-12T22:30:00-05:00"
    },
    {
      "id": "OBJ-05",
      "area": "objective",
      "requirement": "Clark exposes its own scoped MCP server, Clark Bridge, over the same canonical project state used by Studio.",
      "ownerRole": "Connect + Domain + Security Leads",
      "proofRequired": ["design_document", "adr", "schema", "prototype", "automated_test"],
      "result": "prototype_verified",
      "evidence": [
        {"kind": "design_document", "location": "mcp-ecosystem.md", "claim": "Defines Bridge clients, tools, resources, prompts, scopes, jobs, and state-equivalence invariant.", "result": "pass"},
        {"kind": "adr", "location": "decisions/0004-capabilities-above-mcp.md", "claim": "Requires Clark to consume and expose MCP through canonical domain commands and queries.", "result": "pass"},